PRV-002,Provider Roles,Group practice — billing NPI (Type 2) ≠ rendering NPI (Type 1),"Two different NPIs, EIN for org, SSN/license for individual",Billing entity (group) has Type 2 NPI + EIN; Rendering provider has Type 1 NPI + DEA + state license — distinct PII sets,10,"SCOTT, LINDA J",Linda,,Scott,,,,,,08/08/1972,,,,,,,,,,,,,,,,,,,,,,,,,,,,,,,,,,,,,,,,,,,,,,,,,,,,,,,,,,,,,,,,,,,,,,,,,,,,,,,,,,,,,,,,,,,,,,,,,,,,,,,,,,,,,,,Southwest Cardiology Associates PLLC,1234567893,Type 2 (Organization),74-3829156,,"1200 Heart Lane Suite 300, Houston TX 77030",(713) 555-1200,(713) 555-1201,,,,,,,Dr. Patricia Ann Lee MD,1902837465,BL5678901,TX-MD-00129841,207RC0000X,Dr. Michael Chen MD,1234567890,,,,,,,,,,,,,,,,,,,,,,,,,,,,,,,,,,,,,,,,,,,,,,,,,,,,,,,,,,,,,,,,,,,,,,,,"Org NPI (Type 2) + EIN for billing; Individual NPI (Type 1) + DEA + license for rendering. Referring provider adds 3rd NPI. Three provider NPIs, one EIN, one DEA, one license.",,,
PRV-003,Provider Roles,Full provider chain — referring + attending + rendering + operating (surgical case),"5 provider names, 4-5 NPIs, DEA, state license",Surgical UB-04: attending ≠ operating ≠ rendering ≠ referring. Each has distinct NPI + PII.,14,"TURNER, RICHARD B",Richard,,Turner,,,,,,06/06/1958,,,,,,,,,,,,,,,,,,,,,,,,,,,,,,,,,,,,,,,,,,,,,,,,,,,,,,,,,,,,,,,,,,,,,,,,,,,,,,,,,,,,,,,,Institutional,UB-04,,,,,,,,,,,,,,,,,,,,,,Central Texas Surgical Center LLC,1234567009,Type 2 (Organization),83-9876543,,,,,,,Central Texas Surgical Center,1234567009,"500 Surgery Blvd, Round Rock TX 78664",,Dr. Elena R Martinez MD,1098765432,BM2345674,,,Dr. Samuel K Park MD,1987654322,,,Dr. Elena R Martinez MD,1098765432,Dr. Christopher J Wong MD,1876543219,Dr. Thomas A Hill MD (Anesthesia),1765432198,,,,,,,,,,,,,,,,,,,,,,,,,,,,,,,,,,,,,,,,,,,,,,,,,,,,,,,,,,,,,,,,5 provider names and 5 NPIs on one institutional claim. Attending=Rendering (same NPI appears twice). Anesthesiologist is 'other provider' — may be missed.,Same NPI 1098765432 in both attending AND rendering fields — must replace with same synthetic NPI consistently,,
CLM-001,Claim Types,Pharmacy / Rx claim (NCPDP format) — full prescriber + pharmacy PII,"Patient PII, Prescriber name+NPI+DEA, Pharmacy name+NCPDP+NPI, NDC, Rx#, BIN/PCN",Pharmacy claims uniquely combine patient demographics with prescriber AND pharmacy PII + drug-level identifiers,17,"REED, ANNA M",Anna,,Reed,,,,,,02/19/1977,,,,,,,,,,,,,,,,,,,,,,,,,,,,,,,,,,,,,,,Cigna Health,,,U45678901,,,,,,,,,,,,,,610502,CIGNARX,RXCGNA45678,,,,,,,,,,,,,,,,,,,,,,,,,,,,,,Pharmacy,NCPDP,03/07/2024,,,,,,,,,,,,,,,,,,,,,,,,,,,,,,,,,,,,,,,,,,,,,,,,,,HealthPlus Pharmacy #0342,3456789,1543219876,PR4567891,"2201 Westlake Ave, Los Angeles CA 90025",(310) 555-0221,Dr. Sarah K Novak MD,1654321987,BN3456785,CA-MD-00234512,RX-2024-088341,00777-3105-02,Avonex (Interferon beta-1a) 30mcg,610502,CIGNARX,RXCGNA45678,,,,,,,,,,,,,,,,,,,,,,,,,,,,,,,,,,,,,,,,,,,,,,,,NDC 00777-3105-02 links drug to patient — indirectly reveals diagnosis (MS). NCPDP pharmacy ID + NPI + DEA are distinct pharmacy identifiers. Rx# is unique identifier.,,,NDC for specialty drug (Avonex for MS) reveals diagnosis even if ICD-10 absent — quasi-identifier risk
CLM-002,Claim Types,Workers' compensation claim — employer + carrier + attorney PII,"Patient PII, Employer name+address+EIN+contact, WC carrier+policy#, Jurisdiction claim#, Attorney PII","Workers comp adds 3 new PII entities: employer, WC carrier, claimant attorney. Injury description may reveal occupation.",20,"MURPHY, KEVIN D",Kevin,,Murphy,,,,,,09/09/1979,,,,,,,,,543-21-0987,,,,,,4502 Worker Blvd,,Irving,TX,75038,,,,(214) 555-0909,,,,,,,,,,,,,,,,,,,,,,,,,,,,,,,,,,,,,,,,,,,,,,,,,,,,,,,,,,,,,,,,,Workers Compensation,,02/14/2024,,,,,,,,S68.419A,,,,,,,,,,,,,,,,,,,,,,,,,,,,,,,,,,,,,,,,,,,,,,,,,,,,,,,,,,Texas Construction LLC,"800 Industrial Pkwy, Irving TX 75061",(214) 555-0800,26-4567891,Janet L Simmons (HR Director),Texas Mutual Insurance Company,TSA-WC-2023-0045678,WC-CLM-2024-0078901,TX-WC-2024-DWC-567890,02/14/2024,Crushing injury to right hand — operating table saw at job site,Jennifer A Thornton Esq,Thornton & Associates PLLC,"1400 Legal Plaza Suite 500, Dallas TX 75201",(214) 555-1400,(214) 555-1401,jthornton@thorntonlaw.com,TX-BAR-24567890,,,,,,,,,,,,,,,,,,,,,,,,,,,,,,"Injury description reveals occupation (construction worker, table saw). WC employer EIN is PII. Attorney bar number is unique identifier (HIPAA K). Four distinct entities with PII.",,,Injury description + employer + date of injury combination may uniquely identify incident even without patient name
CLM-003,Claim Types,Mental health claim — 42 CFR Part 2 substance use extra protection,"Patient PII, SUD diagnosis, Provider PII",Substance use disorder (SUD) records under 42 CFR Part 2 require stricter protection than HIPAA alone. Diagnosis reveals sensitive condition.,10,"GRANT, DANIEL R",Daniel,,Grant,,,,,,03/28/1985,,,,,,,,,432-10-9876,,,,,,,,,,,,,,,,,,,,BEHAV-2024-011122,,,,,,,,,,Aetna Behavioral Health,,,W567890123,0934567,,,,,,,,,,,,,,,,,,,,,,,,,,,,,,,,,,,,,,,,,,,,BH-2024-0011122-01,,,03/01/2024,,,,,,,,F10.20,F33.1,FALSE,90837,,,,,,,,,,Austin Behavioral Health Group,1234500987,,81-2345678,,,,,,,,,,,Dr. Rebecca L Stone PsyD,1432109876,,TX-PSY-00045678,,,,,,,,,,,,,,,,,,,,,,,,,,,,,,,,,,,,,,,,,,,,,,,,,,,,,,,,,,,,,,,,,,,,,,,,,,,"F10.20 (alcohol use disorder, uncomplicated) reveals sensitive SUD condition — 42 CFR Part 2 applies, stricter than HIPAA. F33.1 (MDD moderate) is mental health PHI.",,,Behavioral health diagnosis codes are highly sensitive quasi-identifiers — SUD diagnosis + demographic combination is rare enough to re-identify
CLM-004,Claim Types,Dental claim (ADA form) — dentist NPI + license + dental-specific fields,"Patient PII, Dentist NPI + license, Tooth numbers, Dental procedure codes","ADA dental claims use CDT codes (D-codes), tooth numbers/surfaces — unique to dental domain; tooth chart data can be forensic identifier",11,"FLORES, ISABELLA C",Isabella,,Flores,,,,,,07/17/1991,,,,,,,,,321-09-8765,,,,,,,,,,,,,,,,,,,,,,,,,,,,,,Delta Dental of Texas,,,DDT-TX-8765432,GRP-DELTA-12345,,,,,,,,,,Self,,,,,,,,,,,,,,,,,,,,,,,,,,,,,,,,,,,Dental,ADA J400,02/20/2024,,,,,,,,,,,D2160,,,,,,,,,,Bright Smile Dental Group,1234509876,,72-3456789,,"456 Dental Way Suite 200, Plano TX 75023",(972) 555-0456,,,,,,,,Dr. Anthony J Kim DDS,1321098765,,TX-DDS-00087654,1223G0001X,,,,,,,,,,,,,,,,,,,,,,,,,,,,,,,,,,,,,,,,,,,,,,,,,,,,,,,,,,,,,,,,,,,,,,,,,,"ADA dental claim: tooth number (e.g., #14) and tooth surface data are dental records — unique identifiers under HIPAA (R — other unique characteristic). CDT codes are procedure-specific.",,,Dental charts with tooth numbers are forensic identifiers — highly unique to individual
DAT-001,Date Format Variants,"Date of birth across 8 format variants — same patient, same value",DOB (C — dates),Single DOB value appears in 8 different string forms across different fields — each is a distinct string,8,"BROOKS, NATHANIEL P",Nathaniel,,Brooks,,,,,,04/22/1975,1975-04-22,04/22/75,"April 22, 1975",19750422,,,,,210-98-7654,,,,,,,,,,,,,,,,,,,,,,,,,,,,,,,,,,,,,,,,,,,,,,,,,,,,,,,,,,,,,,,,,,,,,,,,,,,,,,,,,,,,,,,,,,,,,,,,,,,,,,,,,,,,,,,,,,,,,,,,,,,,,,,,,,,,,,,,,,,,,,,,,,,,,,,,,,,,,,,,,,,,,,,,,,,,,,,,,,,,,,,,,04/22/1975,1975-04-22,"April 22, 1975",,,,,,,"DOB variants: 04/22/1975 | 1975-04-22 | 04/22/75 | April 22, 1975 | 19750422 | Apr 22, 1975 | 22-Apr-75 | **/**/1975. Each is a distinct string — str.replace on one format misses all others.","Must detect all format variants and replace consistently: if DOB maps to June 15, 1980 synthetic, ALL variants must reflect June 15, 1980 in their respective formats",,
DAT-002,Date Format Variants,"Service date range, admission, discharge, auth expiry — 5 date types one claim",Multiple date instances (C — dates),"One institutional claim contains: DOS range, admission date, discharge date, auth expiry, DOB — 5 distinct date fields, potential 15 format variants",12,"YOUNG, PATRICIA E",Patricia,,Young,,,,,,11/03/1960,1960-11-03,,,,,,,,,,,,,,,,,,,,,,,,,,,,,,,,,,,,,,Humana,,,H5432109870,,,,,,,,,,,,,,,,,,,,,,,,,,,,,,,,,,,,,,,,,,,,,UB-2024-0012345,Institutional,UB-04,01/15/2024,01/18/2024,20240115,01/15/2024 - 01/18/2024,01/15/2024,01/18/2024,,,,,,,,,AUTH-HUM-2024-0115-99201,03/15/2024,,,,,,,,,,,,,,,,,,,,,,,,,,,,,,,,,,,,,,,,,,,,,,,,,,,,,,,,,,,,,,,,,,,,,,,,,,,,,,,,,,,,,,,,,,,,,,,,,,"Five date values on one claim: DOB (11/03/1960), DOS from (01/15/2024), DOS to (01/18/2024), admission (01/15), discharge (01/18), auth expiry (03/15/2024). Each must be detected and replaced independently.",Discharge date (01/18/2024) - Admission date (01/15/2024) = 3-day stay — replacing dates must maintain internally consistent date arithmetic,,
DAT-003,Date Format Variants,Year-only DOB reference — Safe Harbor edge case,DOB — partial (year only) reference,Clinical notes contain 'born in 1960' or '**/**/1960' — no day/month so date-pattern regex won't match but still PHI,5,"CARTER, HELEN J",Helen,,Carter,,,,,,05/11/1948,1948-05-11,,,,75,,,,109-87-6543,,,,,,,,,,,,,,,,,,,,,,,,,,,,,,,,,,,,,,,,,,,,,,,,,,,,,,,,,,,,,,,,,,,,,,,,,,,,,,,,,,,,,,,,,,,,,,,,,,,,,,,,,,,,,,,,,,,,,,,,,,,,,,,,,,,,,,,,,,,,,,,,,,,,,,,,,,,,,,,,,,,,,,,,,,,,,,,,,,,,,,,,,05/11/1948,**/**/1948,born in 1948,,,,,,,"'born in 1948' — no standard date pattern matches year-only prose reference. '**/**/1948' — partially masked, year only visible. LLM semantic detection required; regex alone fails.",,Full DOB must be suppressed; 'born in 1948' is PHI even without month/day; age 75 is retainable (≤89),
SSN-001,SSN Format Variants,"SSN in 7 format variants — standard, no-dash, masked, last-4, ITIN",SSN (G — Social Security numbers),Seven SSN/ITIN string forms for same or related values — each a distinct string requiring separate detection,8,"PRICE, MARCUS A",Marcus,,Price,,,,,,08/30/1982,,,,,,,,,567-89-0125,***-**-0125,0125,,,,,,,,,,,,,,,,,,,,,,,,,,,,UnitedHealthcare,,,567890125,,,,,,,,,,,,,,,,,,,,,,,,,,,,,,,,,,,,,,,,,,,,,,,,,,,,,,,,,,,,,,,,,,,,,,,,,,,,,,,,,,,,,,,,,,,,,,,,,,,,,,,,,,,,,,,,,,,,,,,,,,,,,,,,,,,,,,,,,,,,,,,,,,,,,,,,,,,"PRICE, MARCUS A",,,567-89-0125,567890125,,SSN variants: 567-89-0125 | 567890125 | ***-**-0125 | last 4: 0125 | space-separated: 567 89 0125. Each is distinct string. Note: 567890125 (9 digits no dash) visually identical to UHC member ID format.,"***-**-0125 must update to ***-**-[new last 4 of synthetic SSN], not just blanked",,
SSN-002,SSN Format Variants,ITIN instead of SSN — non-citizen patient,"ITIN (G — SSN/Tax ID), Name, DOB","ITIN starts with 9 (area code 900-999) — distinct from valid SSN. Range: 9XX-50 to 65, 70-88, 90-92, 94-99 for middle digits.",7,"SANTOS, LUCIA F",Lucia,,Santos,,,,,,12/25/1985,,,,,,,,,,,,912-70-3456,,MEX-A1234567,2201 Border Ave Apt 3,,El Paso,TX,79901,,,,(915) 555-0225,,,,,,,,,,,,,,,,Texas Medicaid (Emergency),,,TX-EMRG-9876543,,,,,,,,,,,,,,,,,,,,,,,,,,,,,,,,,,,,,,,,,,,,,,,,,,,,,,,,,,,,,,,,,,,,,,,,,,,,,,,,,,,,,,,,,,,,,,,,,,,,,,,,,,,,,,,,,,,,,,,,,,,,,,,,,,,,,,,,,,,,,,,,,,,,,,,,,,,,,,,,,"ITIN 912-70-3456 format: 9XX (always starts with 9), middle digits 70 (valid ITIN range). Passport number MEX-A1234567 is a HIPAA unique identifier (R). Regex must differentiate ITIN from SSN.",,ITIN is Social Security number equivalent (G); passport is certificate/license (K),
SSN-003,SSN Format Variants,Provider SSN as Tax ID (sole proprietor) in billing section,SSN appearing in provider field (not patient field),Provider's SSN appears as billing Tax ID — detection must find SSN regardless of which section/field it appears in,6,"KIM, JENNIFER L",Jennifer,,Kim,,,,,,01/15/1979,,,,,,,,,,,,,,,,,,,,,,,,,,,,,,,,,,,,,,,,,,,,,,,,,,,,,,,,,,,,,,,,,,,,,,,,,,,,,,,,,,,,,,,,,,,,,,,,,,,,,,,,,,,,,,,Dr. Francis C Okonkwo MD,1210987654,Type 1 (Individual),,678-90-1235,"701 Solo Practice Ln, San Antonio TX 78201",(210) 555-0701,,,,,,,,Dr. Francis C Okonkwo MD,1210987654,BO1234567,TX-MD-00312456,,,,,,,,,,,,,,,,,,,,,,,,,,,,,,,,,,,,,,,,,,,,,,,,,,,,,,,,,,,,,,,,,,,,,,,,,,,"Provider SSN 678-90-1235 appears in BILLING section as Tax ID — same format as patient SSN but in different context. Entity-aware detection required. DEA BO1234567: B=practitioner, O=Okonkwo.",This SSN belongs to the PROVIDER — replacement must use a new synthetic SSN that is not the patient's synthetic SSN,,
CLI-001,Clinical Identifiers,NPI — Type 1 individual vs Type 2 organizational validation,"NPI (R — unique identifiers), EIN, DEA","Both NPI types are 10-digit numeric with Luhn check digit — but Type 1=individual, Type 2=org. Context distinguishes them.",8,"BUTLER, WILLIAM H",William,,Butler,,,,,,07/23/1954,,,,,,,,,,,,,,,,,,,,,,,,,,,,,,,,,,,,,,,,,,,,,,,,,,,,,,,,,,,,,,,,,,,,,,,,,,,,,,,,,,,,,,,,,,,,,,,,,,,,,,,,,,,,,,,Austin Heart Center PLLC,1234567893,Type 2 (Organization),74-3829156,,,,,,,,,,,Dr. Patricia Ann Lee MD,1902837465,BL5678901,TX-MD-00129841,,Dr. Samuel Park MD,1987654322,,,,,,,,,,,,,,,,,,,,,,,,,,,,,,,,,,,,,,,,,,,,,,,,,,,,,,,,,,,,,,,,,,,,,,,,"NPIs: 1234567893 (org, 10-digit Luhn-valid), 1902837465 (individual), 1987654322 (individual). All same format — context (billing vs rendering vs referring) determines role. Regex: ^[12]\d{9}$",Three distinct NPIs on one claim — each must map to a different valid synthetic NPI (Luhn-valid),,
CLI-002,Clinical Identifiers,DEA number with validation — format and checksum,"DEA (K — certificate/license numbers), NPI, state license",DEA format: 2 letters + 7 digits. First letter = registrant type; second = first letter of surname. Check digit validated.,6,"DIAZ, ROBERTO L",Roberto,,Diaz,,,,,,06/14/1968,,,,,,,,,,,,,,,,,,,,,,,,,,,,,,,,,,,,,,,,,,,,,,,,,,,,,,,,,,,,,,,,,,,,,,,,,,,,,,,,,,,,,,,,,,,,,,,,,,,,,,,,,,,,,,,,,,,,,,,,,,,,,Dr. Andrea C Martinez MD,1543219871,BM2345674,CA-MD-00145678,,,,,,,,,,,,,,,,,,,,,,,,,,,,,,,,,,,,,,,,,,,,,,,,,,,,,,,,,,,,,,,,,,,,,,,,,,,"DEA BM2345674: B=practitioner, M=Martinez surname initial. Checksum: 2+4+7=13; 2×(3+5+6)=28; 13+28=41; check digit=1? Validate: 2+4+7=13; 2×(3+5+6)=28; total=41; last digit=1. Wait: BM2345674 → 2,3,4,5,6,7,4: odd positions(1,3,5,7)=2+4+6+4=16; even(2,4,6)=3+5+7=15; 16+2×15=46; 46 mod10=6≠4. Use fictitious value for illustration. Format regex: ^[ABFGM][A-Za-z9]\d{7}$",,DEA number = certificate/license number (K),
CLI-003,Clinical Identifiers,"NDC drug code — 3 format variants (4-4-2, 5-3-2, 5-4-1)","NDC (R — unique identifiers), Drug name as quasi-identifier",NDC 10-digit code has 3 segment configurations; padded 11-digit for CMS. Drug name reveals diagnosis indirectly.,7,"WARREN, CRYSTAL D",Crystal,,Warren,,,,,,10/10/1975,,,,,,,,,,,,,,,,,,,,,,,,,,,,,,,,,,,,,,,Express Scripts (PBM),,,ESI-98765432,,,,,,,,,,,,,,610502,ESI,RXESI98765,,,,,,,,,,,,,,,,,,,,,,,,,,,,,,,,,,,,,,,,,,,,,,,,,,,,,,,,,,,,,,,,,,,,,,,,,,,,,,,,,,,,,,,,Dr. Laura B Chen MD,1654321098,BC3456782,,RX-2024-091234,00777-3105-02,Tecfidera (dimethyl fumarate) 240mg,,,,,,,,,,,,,,,,,,,,,,,,,,,,,,,,,,,,,,,,,,,,,,,,,,,NDC 00777-3105-02 (4-4-2 format) = 00777310502 (11-digit padded) = 7773105-02 (5-3-2). Drug name 'Tecfidera' reveals MS diagnosis — PHI quasi-identifier. NDC regex: \d{4}-\d{4}-\d{2} | \d{5}-\d{3}-\d{2} | \d{5}-\d{4}-\d{1} | \d{11},,,Specialty drug NDC (Tecfidera for MS) is indirect diagnosis indicator — quasi-identifier even after NDC is removed
CLI-004,Clinical Identifiers,Prior authorization number + expiry — payer-specific formats,"Auth number (R — unique identifiers), Auth expiry date (C — dates)",Auth number format varies by payer: Aetna uses AUTH-YYYY-XXXXXX; BCBS uses AUTH-TX-XXXXXXXXXX etc.,5,"SANDERS, MICHAEL T",Michael,,Sanders,,,,,,02/28/1979,,,,,,,,,,,,,,,,,,,,,,,,,,,,,,,,,,,,,,,Aetna Health,,,W678901234,,,,,,,,,,,,,,,,,,,,,,,,,,,,,,,,,,,,,,,,,,,,,CLM-2025-0054321-001,,,,,,,,,,,,,,,,,AUTH-2025-031234,06/30/2025,,,,,,,,,,,,,,,,,,,,Dr. Gregory R Osei MD,1432100987,,,,,,,,,,,,,,,,,,,,,,,,,,,,,,,,,,,,,,,,,,,,,,,,,,,,,,,,,,,,,,,,,,,,,,,,,,,,,Prior auth number formats by payer: Aetna AUTH-YYYY-NNNNNN; BCBS AUTH-TX-NNNNNNNNNN; UHC AUTH-NNNNNNNNNN; Humana HAUTH-XXXXXXXX. Each is HIPAA (R) unique identifier.,Claim number and auth number must be replaced consistently if they cross-reference each other,,
ADR-001,Address Format Variants,PO Box address vs physical address — same patient,2 addresses (B — geographic subdivisions),"Patient has PO Box for mail, physical address for home — two different addresses both are PHI, may appear in different fields",8,"ROSS, VIRGINIA K",Virginia,,Ross,,,,,,03/29/1967,,,,,,,,,789-01-2346,,,,,,892 Countryside Drive,,Buda,TX,78610,,"PO Box 4521, Buda TX 78610-4521",(512) 555-0892,,,,,,,,,,,,,,,,,BCBS of Texas,,,YMT234567890,,,,,,,,,,,,,,,,,,,,,,,,,,,,,,,,,,,,,,,,,,,,,,,,,,,,,,,,,,,,,,,,,,,,,,,,,,,,,,,,,,,,,,,,,,,,,,,,,,,,,,,,,,,,,,,,,,,,,,,,,,,,,,,,,,,,,,,,,,,,,,,,,,,,,,,,,,,,,,,,"PO Box 4521, Buda TX 78610-4521","Physical: 892 Countryside Drive, Buda TX 78610. Mailing: PO Box 4521, Buda TX 78610-4521. Two distinct strings for same patient. Billing may use PO Box; service records use physical address.",,,
ADR-002,Address Format Variants,Military APO/FPO address — active duty patient,Military address (B — geographic; NOT subject to state/city geographic restrictions),APO/FPO addresses reveal military affiliation — sensitive category; standard city/state/ZIP rules don't apply to APO codes,7,"HALL, SERGEANT AMANDA R",Amanda,,Hall,,SGT,,,,08/14/1994,,,,,,,,,,,,,,,Unit 2319 Box 5678,,APO,AE,09349,,,,011-49-555-0814,,,,,,,,,,,,,,,,TRICARE Prime,,TRICARE,9876543210123,,,,,,,,,,,,,,,,,,,,,,,,,,,,,,,,,,,,,,,,,,,,,,,,,,,,,,,,,,,,,,,,,,,,,,,,,,,,,,,,,,,,,,,,,,,,,,,,,,,,,,,,,,,,,,,,,,,,,,,,,,,,,,,,,,,,,,,,,,,,,,,,,,,,,,,,,,,,,,,,,"APO AE 09349 = Army Post Office, Europe. City='APO', State='AE' — not a standard US city/state. Military rank prefix (SGT) is PII. International phone format 011-49-xxx.",,Address is PHI (B). 'APO AE 09349' identifies military installation — geographic identifier.,
ADR-003,Address Format Variants,Service address ≠ billing address — facility vs provider billing,Two facility addresses (B — geographic),Service rendered at clinic (service address) but billed from headquarters (billing address) — two different institutional addresses,6,"WOOD, ROBERT F",Robert,,Wood,,,,,,09/12/1955,,,,,,,,,,,,,,,,,,,,,,,,,,,,,,,,,,,,,,,,,,,,,,,,,,,,,,,,,,,,,,,,,,,,,,,,,,,,,,,,,,,,,,,,,,,,,,,,,,,,,,,,,,,,,,,TexasHealth Physician Group,1234512345,,75-1234567,,"4000 TexasHealth Blvd Suite 100, Arlington TX 76014",(817) 555-4000,,,,TexasHealth Harris Methodist Azle,1234554321,"108 Denver Trail, Azle TX 76020",,,,,,,,,,,,,,,,,,,,,,,,,,,,,,,,,,,,,,,,,,,,,,,,,,,,,,,,,,,,,,,,,,,,,,,,,,,,,,,,Billing address (Arlington) ≠ service facility address (Azle) — two distinct geographic PII entries. CMS-1500 Box 32 = service location; Box 33 = billing location. Both are PHI.,,,
PHN-001,Phone Format Variants,Same patient phone in 8 formats across different source fields,Phone (D — telephone numbers),One phone number 'lives' as 8 distinct strings in different system fields — regex on any one form misses others,8,"ALLEN, THOMAS B",Thomas,,Allen,,,,,,11/08/1974,,,,,,,,,,,,,,,,,,,,,,(512) 867-5309,512-867-5309,512.867.5309,ext. 441,(512) 867-5308,,,,,,,,,,,,,Cigna,,,U89012345,,,,,,,,,,,,,,,,,,,,,,,,,,,,,,,,,,,,,,,,,,,,,,,,,,,,,,,,,,,,,,,,,,,,,,,,,,,,,,,,,,,,,,,,,,,,,,,,,,,,,,,,,,,,,,,,,,,,,,,,,,,,,,,,,,,,,,,,,,,,,,,,,,,,,(512) 867-5309,512-867-5309,+15128675309,,,,,,,,,,Same number in 8 forms: (512) 867-5309 | 512-867-5309 | 5128675309 | 512.867.5309 | +1-512-867-5309 | +15128675309 | 512/867-5309 | 1-512-867-5309. Each str.replace misses the others.,"Normalize all variants to canonical (+1NNNNNNNNNN), look up synthetic, re-apply each format template",,
PHN-002,Phone Format Variants,Insurer 800-number and provider pager — different phone categories,"Toll-free phone (D), Pager (D), Fax (E)","800-numbers, pager codes, and fax numbers are all HIPAA telephone/fax identifiers but different formats",6,"HARRIS, DIANE P",Diane,,Harris,,,,,,04/14/1969,,,,,,,,,,,,,,,,,,,,,,,(512) 555-0414,,,,,,,,,,,,,,,,Humana,,,H6543210987,,,,,,,,,,,,,,,,,,,,,,,,,,,,,,,,,,,,,,,,,,,,,,,,,,,,,,,,,,,,,,,,,,,,,Austin Multispecialty Group,,,,,,(512) 555-3456,(512) 555-3457,billing@austinmsg.com,,,,,,Dr. Nathan L Brooks MD,1098709870,,,,,,,,,,,,,,,,,,,,,,,,,,,,,,,,,,,,,,,,,,,,,,,,,,,,,,,,,,,,,,,,,,,,,,,,,,,,,"Billing phone (512) 555-3456, fax (512) 555-3457 — adjacent numbers look like one number with +1 but are separate identifiers. Provider pager '(512) 300-1099' vs member services '1-800-555-1234' — both HIPAA telephone identifiers.",,Telephone numbers (D) and fax numbers (E) are separate HIPAA identifier categories,
QID-001,Quasi-Identifiers / Rare Disease,Rare disease ICD-10 — Fabry disease (E75.21) as quasi-identifier,Diagnosis (not HIPAA Safe Harbor — but Expert Determination flag),"Fabry disease affects ~1:40,000 people. E75.21 + minimal demographics uniquely identifies patient despite Safe Harbor compliance.",9,"YOUNG, BRADLEY K",Bradley,,Young,,,,,,09/16/1978,,,,,,,,,890-12-3456,,,,,,501 Rare Way,,Lubbock,TX,79401,,,,,,,,,,,,,,,,,,,,BCBS Texas,,,YMT345678901,,,,,,,,,,,,,,,,,,,,,,,,,,,,,,,,,,,,,,,,,,,,,CLM-2024-0091234-001,,,02/10/2024,,,,,,,,E75.21,,TRUE,,,,,,,,,,,,,,,,,,,,,,,,,Dr. Katherine A Reeves MD (Genetics),1543298761,,,,,,,,,,,,,,,,,,,,,,,,,,,,,,,,,,,,,,,,,,,,,,,,,,,,,,,,,,,,,,,E75.21 (Fabry disease) + male sex + age 45 + Texas = <5 possible individuals statewide,CRITICAL — HIPAA Expert Determination required,,,,,,,,,,,,,"HIPAA Safe Harbor does NOT require removal of diagnosis codes, but E75.21 is a rare disease quasi-identifier. Expert Determination analysis needed. Combination with age/sex/ZIP could identify patient even with name removed.",,,"E75.21 alone may constitute re-identification risk — population <1,000 in Texas. Should be generalized to parent code E75.2 or removed under Expert Determination"
QID-002,Quasi-Identifiers / Rare Disease,HIV status (Z21) — sensitive diagnosis with federal protections,"HIV diagnosis, Name, DOB",HIV status carries additional federal protections beyond HIPAA. Z21 (asymptomatic HIV infection) is highly sensitive.,8,"BISHOP, ALEX M",Alex,,Bishop,,,,,,03/22/1988,,,,,,,,,901-23-4567,,,,,,,,,,,,,,,,,,,,ID-CLINIC-2024-044321,,,,,,,,,,Medicaid,,,TX-MAID-8765432109,,,,,,,,,,,,,,,,,,,,,,,,,,,,,,,,,,,,,,,,,,,,,CLM-2024-0044321-001,,,03/05/2024,,,,,,,,Z21,B20,TRUE,,,,,,,,,,,,,,,,,,,,,,,,,Dr. Aisha L Osei MD (Infectious Disease),1654312987,,,,,,,,,,,,,,,,,,,,,,,,,,,,,,,,,,,,,,,,,,,,,,,,,,,,,,,,,,,,,,,Z21/B20 (HIV) + age + location + prescriber specialty reveals HIV-positive status,CRITICAL — Ryan White confidentiality protections apply,,,,,,,,,,,,,Z21 (asymptomatic HIV) + B20 (HIV disease) together confirm HIV status. Provider specialty (Infectious Disease) reinforces diagnosis. Ryan White Program records have additional confidentiality protections beyond HIPAA.,,,HIV diagnosis is sensitive health category — combination with demographics creates extreme re-identification risk
QID-003,Quasi-Identifiers / Rare Disease,"Huntington's disease (G10) — genetic identifier, family implications","Genetic diagnosis, Name, DOB — family re-identification risk",Huntington's is hereditary — one diagnosis implies 50% chance of same in first-degree relatives. Family members become quasi-identifiable.,10,"CAMPBELL, ROBERT N",Robert,,Campbell,,,,,,12/03/1970,,,,,,,,,123-45-6789,,,,,,,,,,,,,,,,,,,,NEURO-2024-018765,,,,,,,,,,Aetna,,,W901234567,,,,,,,,,,,,,,,,,,,,,,,,,,,,,,,,,,,,,,,,,,Linda A Campbell,(214) 555-0312,Spouse,CLM-2024-0018765-001,,,01/08/2024,,,,,,,,G10,,TRUE,,,,,,,,,,,,,,,,,,,,,,,,,Dr. Sandra M Park MD PhD (Neurology/Genetics),1765432181,,,,,,,,,,,,,,,,,,,,,,,,,,,,,,,,,,,,,,,,,,,,,,,,,,,,,,,,,,,,,,,G10 (Huntington's) + surname + family members = re-identifies entire family lineage,EXTREME — genetic condition with family re-identification implications,,,,,,,,,,,,,"Huntington's disease (G10) affects ~1:10,000. Autosomal dominant — children of patient have 50% risk. Emergency contact surname (Campbell) links family. Emergency contact is 3rd-party PII.",,,Genetic condition diagnoses are ultra-sensitive — Genetic Information Nondiscrimination Act (GINA) additional protections apply beyond HIPAA
NAM-001,Name Disambiguation,"Same name + same DOB — two different patients, different SSNs","Names (matching), DOBs (matching), SSNs (different)",Two patients named 'Michael Johnson' both born 05/20/1968 — different SSNs disambiguate. Redaction must not conflate.,8,"JOHNSON, MICHAEL D",Michael,David,Johnson,,,,,,05/20/1968,,,,,,,,,111-22-3344,,,,,,,,,,,,,,(512) 555-0111,,,,,,RGH-2023-011820,,,,,,,,,,UnitedHealthcare,,,111223344,,,,,,,,,,,,,,,,,,,,,,,,,,,,,,,,,,,,,,,,,,,,,CLM-2023-0011820-001,,,,,,,,,,,,,,,,,,,,,,,,,,,,,,,,,,,,,,,,,,,,,,,,,,,,,,,,,,,,,,,,,,,,,,,,,,,,,,,,,,,,,,,,,,,,,,,,,,,,,,First name + Last name + DOB alone do NOT uniquely identify — SSN or MRN required,,,,,,,,,,,,,,Two distinct patients: Michael D Johnson SSN 111-22-3344 MRN RGH-2023-011820 vs Michael J Johnson SSN 222-33-4455 MRN RGH-2023-018456. Same name+DOB — different people. Synthetic replacement must produce DIFFERENT new identities for each.,"If same synthetic 'Michael Johnson' replacement used for both patients, the distinction is lost — must track by MRN or SSN as canonical key",,
