NAM-002,Name Disambiguation,Same patient — different name forms across same document,"Name variants (A — names): full, short, title+last, initials","Sarah Johnson appears as: 'Sarah Johnson', 'Ms. Johnson', 'Sarah E. Johnson', 'S.E.J.' — 4 different strings, all same person",6,"JOHNSON, SARAH E",Sarah,Elizabeth,Johnson,,,,,,07/22/1990,,,,,,,,,987-65-4321,,,,,,,,,,,,,,,,,,,,RGH-2024-039812,,,,,,,,,,,,,,,,,,,,,,,,,,,,,,,,,,,,,,,,,,,,,,,,,,,,,,,,,,,,,,,,,,,,,,,,,,,,,,,,,,,,,,,,,,,,,,,,,,,,,,,,,,,,,,,,,,,,,,,,,,,,,,,,,,,,,,,,,,,,,,,,,,,,,,,,,,,,,,,,,,,,,,,,Sarah Elizabeth Johnson,Ms. Johnson,S.E.J.,,,,Four name forms for same patient: 'Sarah Elizabeth Johnson' | 'Sarah Johnson' | 'Ms. Johnson' | 'S.E.J.' | 'Sarah E. Johnson' | 'Sarah' (first name only in prose). Each is a distinct string that str.replace on full name misses.,Initials 'S.E.J.' → 'L.C.M.' (if synthetic is Laura Catherine Mitchell). Title+last 'Ms. Johnson' → 'Ms. Mitchell'. Each variant requires its own format-aware replacement,,
IMG-001,DICOM / Imaging Metadata,DICOM study metadata — 10 PII tags in structured fields,All 18 HIPAA identifiers potentially present in DICOM tags,DICOM header contains 30+ PII tags. Burned-in pixel annotations embed PII as image data — invisible to text scanners.,14,"JOHNSON, SARAH E",Sarah,,Johnson,,,,,,07/22/1990,,,,,,,,,987-65-4321,,,,,,,,,,,,,,,,,,,,RGH-2024-039812,,,,,,,,,,BCBS Texas,,,YMT987654321,,,,,,,,,,,,,,,,,,,,,,,,,,,,,,,,,,,,,,,,,,,,,,,,,,,,,,,,,,,,,,,,,,,,,,,,,,,,,,,,,,,,,,,,,,,,,,,,,,,,,,,,,,,,,,,,,,,,,,,,,,,,,,,,,,,,,,,,,,Johnson^Sarah^Elizabeth^^,RGH-2024-039812,19900722,20240316,ACC-RGH-2024-018821,Chen^Michael^^^MD,Riverside General Hospital,Park^Sandra^^^MD,YES — T2-FLAIR overlay with patient name and MRN,,,,,,,,,,,,,,,"DICOM Patient Name tag format: LastName^FirstName^Middle^^ — caret-delimited. Patient ID = MRN. Study date in YYYYMMDD (HL7). Burned-in annotations = PII in pixel data, invisible to text-layer scanner; OCR required.",DICOM tags require pydicom library to access. Burned-in pixel annotations require OCR + image inpainting for replacement.,All 222 DICOM tags addressed by HIPAA Supplement 142. Burned-in annotations covered by identifier Q (full-face photographs and comparable images),
SYS-001,System / Telehealth Metadata,"Telehealth claim — IP address, session data, patient portal URL","IP address (O — IP addresses), URL (N — web URLs), Name, DOB",Telehealth introduces IP address and URL as PHI under HIPAA. IP reveals location even without address field.,11,"TURNER, ALICE V",Alice,,Turner,,,,,,02/26/1981,,,,,,,,,210-09-8765,,,,,,,,,,,,,,,,,,alice.turner81@gmail.com,,RGH-2024-061234,,,https://myhealth.riversidegeneral.org/patient/RGH-2024-039812,192.168.10.45,,,,,,Cigna,,,U90123456,,,,,,,,,,,,,,,,,,,,,,,,,,,,,,,,,,,,,,,,,,,,,,Professional,CMS-1500,03/05/2024,,,,,,,02,G35,,,,,,,,,,,,,,,,,,,,,,,,,,,Dr. Michael Chen MD,1234567893,,,,,,,,,,,,,,,,,,,,,,,,,,,,,,,,,,,,,,,,,,,,,,,,,,,,,,,,,,,,,,,,,,,,,,,,,,,,,IP address 192.168.10.45 is HIPAA O identifier. Patient portal URL contains MRN 'RGH-2024-039812' — URL itself is HIPAA N identifier. POS 02 = telehealth. Session metadata may include device ID (HIPAA M).,,"IP address (O), URL (N) are both explicit HIPAA Safe Harbor identifiers",
INT-001,International Patient,"International patient — passport as primary ID, no SSN","Passport (K — certificate/license numbers), International address, International phone",Non-US patient uses passport instead of SSN. Address and phone formats differ. Insurance may be international/travel.,11,"MÜLLER, HANS W",Hans,Werner,Müller,,,,,,07/14/1959,1959-07-14,,,,,,,,,,,,,GBR-C89012345,14 Kensington Court,,London,England,W8 5DL,,,,+44-20-7946-0958,,,,hans.mueller@gmail.co.uk,,RGH-2024-098765,,,,,,,,,,Cigna Global Health,,International PPO,CGH-INTL-UK-345678,,,,,,,,,,,,,,,,,,,,,,,,,,,,,,,,,,,,,,,,,,,,,,,,,,,,,,,,,,,,,,,,,,,,,,,,,,,,,,,,,,,,,,,,,,,,,,,,,,,,,,,,,,,,,,,,,,,,,,,,,,,,,,,,,,,,,,,,,,,,,,,,,,,,,,,,,,,,,,,,,Passport GBR-C89012345 = UK passport number (K identifier). Umlaut in name (Müller) may cause encoding issues. UK phone +44-20-7946-0958. UK postcode W8 5DL = geographic data (B). No SSN — passport is primary government ID.,Synthetic replacement must use valid UK passport format (3-letter country + letter + 8 digits). UK postcode requires UK-format synthetic.,,
EOB-001,Explanation of Benefits,"EOB document — reveals service details, provider name, amounts paid","Names, DOB, Member ID, Dates of Service, Provider name+address, Remark codes",EOB mailed to subscriber reveals patient's care details — sent to household so sensitive for minor/dependent or transgender patient,13,"JOHNSON, SARAH E",Sarah,,Johnson,,,,,,07/22/1990,,,,,,,,,,,,,,,,,,,,,,,,,,,,,,,,,,,,,,,Blue Cross Blue Shield Texas,,,YMT987654321,GRP-TX-88120,,,David Allen Johnson,08/17/1984,,,,,,,,,,,,,,,,,,,,,,,,,,,,,,,,,,,,,,,,,,,03/15/2024,,,,,,,,,,,,,,,,,,,"$4,250.00",$350.00,,,,,,,,,,,,,,,,,,,,,,,,,,,,,,,,,,,,,,,,,,,,,,,,,,,,,,,,,,,,,,,,,BCBSTX-2024-0039812-001,"David Allen Johnson, 4521 Oak Street, Austin TX 78701",Neurology office visit + MRI brain w/wo contrast,CO-45 (contractual adjustment),,,,,,,,,,,,,,,,,,,,,,,,,EOB sent to subscriber (David) reveals patient (Sarah) received neurology MRI — implicit MS diagnosis disclosure to household. Subscriber name+address on EOB mailing label is 3rd-party PII.,,,Service description 'MRI brain' on EOB reveals neurological condition — indirectly discloses diagnosis to subscriber/household even if diagnosis code not shown
SPX-001,Format Specimen Matrix,Single patient — all PII types in all format variants simultaneously,All 18 HIPAA identifiers in multiple format variants,Maximum edge case density — same patient's data appearing in every known format variant across all PII categories,45,"JOHNSON, SARAH E",Sarah,Elizabeth,Johnson,,,Nguyen,Sarah,,07/22/1990,1990-07-22,07/22/90,"July 22, 1990",19900722,33,F,,,987-65-4321,***-**-4321,4321,,TX-DL-7823041-C,,4521 Oak Street,,Austin,TX,78701,78701-3214,"PO Box 4521, Austin TX 78701",(512) 867-5309,(512) 867-5310,(512) 440-0220,114,(512) 867-5308,sarah.e.johnson@gmail.com,s.johnson@austinisd.org,RGH-2024-039812,,ACCT-00789456,https://myhealth.riversidegeneral.org/patient/RGH-2024-039812,192.168.10.45,,,,,,Blue Cross Blue Shield of Texas,04462,,YMT987654321,GRP-TX-88120,AISD Employee Health Plan,,Sarah Elizabeth Johnson,07/22/1990,987-65-4321,,,,,,,,610415,BCBSTX,RXGRP88120,,,,Aetna Dental,,,W987654321,0798765,,,,,,,,,,Sarah Elizabeth Johnson,,987-65-4321,,,,,Self,David Allen Johnson,(512) 867-0092,Spouse,CLM-2024-0039812-001,,,03/15/2024,03/22/2024,,03/15/2024 - 03/22/2024,03/20/2024,03/22/2024,,,G35,G35.3,,,,,AUTH-BCBS-2024-TX-119820,06/30/2024,,,,,,Riverside General Hospital,1234567893,Type 2,74-3829156,,"2400 Medical Center Dr, Austin TX 78701",(512) 300-1000,,,,,,,,Dr. Michael Chen MD,1234567890,BC1234523,TX-MD-00129834,,Dr. Patricia Lee MD,1902837465,,,,,,,,,,,,,,,,,,,RX-2024-082341,00777-3105-02,Avonex 30mcg IM,,,,,,,,,,,,,,,,,,,,,,,,,,,,,,,,,,,,,,,(512) 867-5310,512-867-5310,+15128675310,07/22/1990,1990-07-22,"July 22, 1990","JOHNSON, SARAH E",Sarah E. Johnson,,987-65-4321,***-**-4321,"4521 Oak Street, Austin TX 78701",Maximum density row — same patient in all format variants. 45 PII instances across all 18 HIPAA identifier categories. Use as comprehensive ground-truth benchmark row.,All format variants must resolve to same synthetic entity. ins1_subscriber_ssn = guarantor_ssn = patient_ssn — one synthetic SSN serves all three fields.,"All 18 identifier categories present: Names(A), Geographic(B), Dates(C), Phone(D), Fax(E), Email(F), SSN(G), MRN(H), Member ID(I), Account#(J), License(K), URL(N), IP(O), Photo/DICOM(Q), Claim#/Auth#(R)",
